Country,Scale,Region,Mandatory policy,Marine Specific,marine included,Implicit_Explicit,Type, Focus,Name,Legislation,Year,Name of Legislation,Objective,Mechanism,Length,Stage,Confirmed,"
Goal",Source,Other/ Notes,
Finland,European Union,Europe,Yes,No,Yes,Implicit,Compensation,Biodiversity,Natura 2000 (Marine),Legislation,2010,"*EU: In the Member States of the European Union, several Directives relevant to compensation are applicable, including the Birds and Habitats Directives, the European Liability Directive, and the EIA and SEA Directives.","EU legislation protects a wide variety of habitats and species. Compensation for damage occurring in Natura 2000 sites is a legal requirement of the EU Birds and Habitats Directives.

Although some working group participants suggest the NNL Initiative should be
restricted to the terrestrial and freshwater environment, others considered it
should also extend to coastal and marine environments. The Strategy and Staff
Working Paper are silent on this issue. Coastal habitats, like many freshwater or
high altitude habitats, are very dynamic and subject to rapid and large-scale
shifts in their physical characteristics (e.g. through coastal erosion, flooding,
rock-fall) with important consequences for biodiversity. This creates specific
challenges to assessing impacts and designing appropriate offsets. The marine
environment presents some additional challenges in applying the mitigation
hierarchy and compensating for residual impacts although there is growing
experience in this in Europe and worldwide, not least from impact assessments
done for marine Natura 2000 sites. 32 It remains debatable whether knowledge is
sufficient to apply compensation in the marine environment in a comprehensive
and systematic way but there is nonetheless considerable potential for offsetting
some types of impacts (e.g. of coastal defences, ports and navigation, energy
infrastructure) in the marine environment, while ensuring additional gains with
regard to existing legal obligations under the MSFD and the nature directives.
Whilst re-creation per se of sea-bed habitats is very difficult, restoration or ?functional re-creation? measures and averted risk offsets33 both offer opportunities in the marine environment. Similarly, although offsetting at the coast requires the resolution of different issues - not least reversibility questions associated with coastal erosion or with saline inundation34 - experience in coastal habitat restoration, creation and enhancement also continues to evolve. Further there may be opportunities to compensate for some marine activities by offsetting in the coastal environment.",,,In Progress,confirmed,NNL,"Tucker, Graham; Allen, Ben; Conway,
Mavourneen; Dickie, Ian; Hart, Kaley; Rayment, Matt; Schulp, Catharina; van Teeffelen,
Astrid (2013) Policy Options for an EU No Net Loss Initiative. Report to the European
Commission. Institute for European Environmental Policy, London.

http://ec.europa.eu/environment/nature/biodiversity/nnl/pdf/Subgroup_NNL_Scope_Objectives.pdf",http://prdrse4all.spc.int/system/files/environment_management_act_2005.pdf,
Finland,National,Europe,Yes,No,Yes,Explicit ,EIA ,Biodiversity,offshore wind farms,Legislation,2011,Act of Environmnetal Impact Assessment,"In Finland a project to implement compensation measures in road planning is currently being piloted (Darbi et al. 2009).

 For instance, in Finland wind farms were only taken into account in 2011 in a decree6 that states that wind farms fall under the EIA law (1) when the farm is composed of ten or more wind turbines or (2) when the total power is at least 30 MW. The EIA was thus not mandatory for the only offshore wind farm in Finland, built in 2008
","In Finland legislation requires avoidance and minimization of losses to nature. In large-scale projects possible measures aiming to avoidance and minimization are examined in the environmental impact assessment (EIA) process. The legislation does not, however, enable the use of ecological compensation in permit procedures. Requirements for compensation are included only into few statutes. (Kniivil„, M. et al.)",,Potential,confirmed,,"Kniivil„, M. et al. ND. Creating market for biodiversity by using habitat banking:preliminary assessment of applicability to Finland. http://ageconsearch.umn.edu/bitstream/199234/2/Kniivil%C3%A4,%20M.pdf 

Darbi et al. 2009.",,
France,National,Europe,Yes,No,Yes,Explicit,Offset,Biodiversity,"National doctrine on the mitigation
hierarchy, and national guidelines
on the mitigation hierarchy, draft habitat banking scheme",Legislation,2007; 2012,"General Environmental Law:
le code de l'environnement (French Environmental Code) last updated on 1 January 2017

- For extracts, see notes and french environmental code extracts file

- Article L. 122 -3 and L. 122-6 of the Environmental Code:
 ? Legal obligation against project owners to avoid, reduce, and offset (ERC) impacts of their projects on the natural environment.

Article L122-6 (Inserted by Order no. 2004-489 of 3 June 2004 Article 1 IV Official Journal of 5 June 2004) The environmental evaluation includes the drawing-up of a report which identifies, describes and evaluates the notable effects which the implementation of the plan or document may have on the environment. This report presents the measures provided for to reduce and, where possible, to compensate for the notable negative effects that the application of the plan may cause to the environment. It sets out the other solutions envisaged and the reasons, notably from the point of view of environmental protection, why the project has been selected.

- Article R.122-14-I of the French Environmental Code ? 
Offsets are legally defined as measures that ?aim to offset the significant negative effects, direct or indirect, of the project that could not be avoided or sufficiently reduced. They are implemented in priority on the damaged site or in proximity to it, so as to ensure its functionality through time. They must ensure that the environmental quality of habitats is globally maintained or, if possible, enhanced?. (Qu‚tier et al., 2014)

- 2012: Doctrine relative a la sequence eviter, reduire et compenser les impacts sur le milieu naturel

Sets the characteristics of the French offset policy to be explicitly NNL including details of international best practice such as additionality, equivalency, permanence, etc. 

- 2013: Lignes directrices nationales sur la sequence eviter, reduire et compenser les impacts sur les milieu naturels

This is the methodological document on how to design and implement offset as required by the French law","No net loss, and ideally, net gain of natural habitats

Offsets are legally defined as measures that ?aim to offset the
significant negative effects, direct or indirect, of the project that could
not be avoided or sufficiently reduced. They are implemented in
priority on the damaged site or in proximity to it, so as to ensure its
functionality through time. They must ensure that the environmental
quality of habitats is globally maintained or, if possible, enhanced?
(article R.122-14-I of the French Environmental Code, our
translation). Quetier et al. 2014)
","Permits granted on the basis of an EIA must now include the mitigation measures presented in the EIA document, including avoidance, reduction and compensation or offset measures.
? Government guidance states that ?implementation of the mitigation hierarchy is intended to conserve the overall environmental quality of habitats, and if possible to achieve a net gain, in particular for degraded habitats, taking into account their sensitivity and general goals for achieving good conservation status of these habitats?. (TenKate and Crowe 2014)

Although changes in the French EIA procedures
have now detailed how other plans or projects must be taken into consideration at the project level, the issue remains that cumulative impacts are addressed through a ??first come, first served?? permitting process. This sets the stage for progressively lowering the thresholds beyond which additional impacts can no longer be considered negligible (i.e. ??death
by a thousand cuts??). Furthermore, no recommendations have been made to ensure compatibility between the data or
methods used for assessing impacts across projects.",,Established,,NNL or NG,Ten Kate and Crowe 2014; Ministry of Ecology Sustainable Development and Energy 2012; Quetier et al 2014; Darbi et al. 2016; Bas et al. 2016,EIA laws set up but compensation only used in certain types of development,
France,European Union,Europe,Yes,No,Yes,Implicit,Compensation,Biodiversity,Natura 2000 (Marine),Legislation,2010,"*EU: In the Member States of the European Union, several Directives relevant to compensation are applicable, including the Birds and Habitats Directives, the European Liability Directive, and the EIA and SEA Directives.","EU legislation protects a wide variety of habitats and species. Compensation for damage occurring in Natura 2000 sites is a legal requirement of the EU Birds and Habitats Directives.

Although some working group participants suggest the NNL Initiative should be
restricted to the terrestrial and freshwater environment, others considered it
should also extend to coastal and marine environments. The Strategy and Staff
Working Paper are silent on this issue. Coastal habitats, like many freshwater or
high altitude habitats, are very dynamic and subject to rapid and large-scale
shifts in their physical characteristics (e.g. through coastal erosion, flooding,
rock-fall) with important consequences for biodiversity. This creates specific
challenges to assessing impacts and designing appropriate offsets. The marine
environment presents some additional challenges in applying the mitigation
hierarchy and compensating for residual impacts although there is growing
experience in this in Europe and worldwide, not least from impact assessments
done for marine Natura 2000 sites. 32 It remains debatable whether knowledge is
sufficient to apply compensation in the marine environment in a comprehensive
and systematic way but there is nonetheless considerable potential for offsetting
some types of impacts (e.g. of coastal defences, ports and navigation, energy
infrastructure) in the marine environment, while ensuring additional gains with
regard to existing legal obligations under the MSFD and the nature directives.
Whilst re-creation per se of sea-bed habitats is very difficult, restoration or ?functional re-creation? measures and averted risk offsets33 both offer opportunities in the marine environment. Similarly, although offsetting at the coast requires the resolution of different issues - not least reversibility questions associated with coastal erosion or with saline inundation34 - experience in coastal habitat restoration, creation and enhancement also continues to evolve. Further there may be opportunities to compensate for some marine activities by offsetting in the coastal environment.",,,In Progress,confirmed,NNL,"Tucker, Graham; Allen, Ben; Conway,
Mavourneen; Dickie, Ian; Hart, Kaley; Rayment, Matt; Schulp, Catharina; van Teeffelen,
Astrid (2013) Policy Options for an EU No Net Loss Initiative. Report to the European
Commission. Institute for European Environmental Policy, London.

http://ec.europa.eu/environment/nature/biodiversity/nnl/pdf/Subgroup_NNL_Scope_Objectives.pdf","In France, the mitigation hierarchy has been enshrined in environmental law since 1976.
More recently, in 2012 and 2013, as a result of the introduction of the Birds, Habitats, and Environmental Liability Directives in 1979, 1992, and 2004 respectively, the French government published guidance on the mitigation hierarchy, with no net loss as an explicit goal (Qu‚tier et al., 2014).

France has a requirement to compensate for negative environmental impacts stipulated in the environmental law since 1976. However, the French compensation requirement was never properly implemented until a set of reforms were introduced starting in 2007 as a result of a national consultative process on environmental policy (called ?Grenelle de l?Environnement?). To streamline offset implementation, France has launched a pilot habitat banking scheme and in 2008 the French ministry for the environment in cooperation with the private ?CDC Biodiversit‚? (a specialized subsidiary of a state-owned sovereign fund) started to implement a first pilot on biodiversity offsets, by restoring natural grasslands in the Crau area in Southern France (5). In June 2011 the French government chose to expand this pilot to several other regions and foster additional habitat banks. Furthermore, French offsetting requirements have been significantly strengthened by the issuance of a ?doctrine? on how to best avoid, reduce and offset (?sequence ERC? (1)) impacts on biodiversity and ecosystems (2) as well as accompanying guidelines (lignes directrices) in 2012. (3)
In 2016 the French national Assembly adopted a new biodiversity law (4), which now also includes the application of the mitigation hierarchy in order to reach the goal of No Net Loss (or preferably Net Gain) of biodiversity. Furthermore, the law allows for 3rd party providers of offsets (habitat banking) who will require the prior approval of the French authorities in order to be able to operate. he ?Lignes directrices nationales sur la s‚quence ‚viter, r‚duire et compenser les impacts sur les milieux naturels? state that if residual impacts remain after avoidance and minimization steps, compensation is mandatory in the case of damage resulting in ?major environmental issues?. Step?by?step recommendations are given as to how to go through the mitigation hierarchy when planning and implementing a project. 31 thematic spread sheets set out single steps or specific cases are presented in some detail, e.g. for marine environments. (Darbi et al. 2016).

A thorough review (Jacob et al.sub.) of about 50 EIAs carried out for coastal and marine projects in France also reveals that an additional pitfall of implementing mitigation measures for coastal and marine contexts lies in the unsuitability of the methodologies used to assess both the ecological losses liable to result from a development project and the ecological gains liable to be generated by an offset measure.(Bas et al. 2016).",
French Guiana,National,South/Central America,Yes,No,Yes,Explicit,Offset,Biodiversity,"National doctrine on the mitigation
hierarchy, and national guidelines
on the mitigation hierarchy, draft habitat banking scheme",Legislation,2007; 2012,"General Environmental Law:
le code de l'environnement (French Environmental Code) last updated on 1 January 2017

- For extracts, see notes and french environmental code extracts file

- Article L. 122 -3 and L. 122-6 of the Environmental Code:
 ? Legal obligation against project owners to avoid, reduce, and offset (ERC) impacts of their projects on the natural environment.

Article L122-6 (Inserted by Order no. 2004-489 of 3 June 2004 Article 1 IV Official Journal of 5 June 2004) The environmental evaluation includes the drawing-up of a report which identifies, describes and evaluates the notable effects which the implementation of the plan or document may have on the environment. This report presents the measures provided for to reduce and, where possible, to compensate for the notable negative effects that the application of the plan may cause to the environment. It sets out the other solutions envisaged and the reasons, notably from the point of view of environmental protection, why the project has been selected.

- Article R.122-14-I of the French Environmental Code ? 
Offsets are legally defined as measures that ?aim to offset the significant negative effects, direct or indirect, of the project that could not be avoided or sufficiently reduced. They are implemented in priority on the damaged site or in proximity to it, so as to ensure its functionality through time. They must ensure that the environmental quality of habitats is globally maintained or, if possible, enhanced?. (Qu‚tier et al., 2014)

- 2012: Doctrine relative a la sequence eviter, reduire et compenser les impacts sur le milieu naturel

Sets the characteristics of the French offset policy to be explicitly NNL including details of international best practice such as additionality, equivalency, permanence, etc. 

- 2013: Lignes directrices nationales sur la sequence eviter, reduire et compenser les impacts sur les milieu naturels

This is the methodological document on how to design and implement offset as required by the French law","In Latin America five territories required the use of offsets (Brazil, Colombia, French Guiana, Mexico and Paraguay (Villaroya et al.)",,,Established,confirmed,,Villarroya et al. 2014; http://creocean.fr/en/eia-marine-environment-french-guiana,,
Gabon,National,Africa,Yes,No,Yes,Implicit,Offset,Environment,Sustainable development law,Legislation,2014,2014 Sustainable Development law (Quieter et al. 2015),,"It establishes the framework for a scheme to attempt to offset harm caused to nature and communities through the purchase of environmental and social credits. The SDL is a ?framework law?, meaning that details will be elaborated in future implementing decrees. At present it simply sets the groundwork for a national credit-trading market, called the sustainable development register.The SDL does not go into detail about sustainable
development concessions beyond saying that sustainable development credits are generated by sustainable development concessions. 7  Gabonese civil society believe they could include the full range of Gabonese concessions including logging concessions, palm oil plantations, mining projects, infrastructure projects and REDD+ concessions.Sustainable development credits are ?generated by the creation or preservation of sustainable development
assets during the project?s activities.?8  For example, a credit could be generated by a conservation project preserving an area of high biodiversity, or by a palm oil
plantation project creating jobs. These sustainable development credits are divided into
four different types, each of which will be difficult to measure (see 5.1):9
? Carbon credits consists of a ?metric tonne of carbon dioxide?
? Biodiversity credits are the ?ecological biodiversity value contained in an ecosystem?
? Ecosystem credits are the ?market and non-market value attributed to an ecosystem?
? Community capital credits are the ?sum of the natural and cultural assets belonging to a
community.?1...... According to the SDL, if a project operator generates
sustainable development credits during the course of
running the project (for example by preserving an area
of biodiversity, or creating a certain number of jobs),
it can place the credits on the national sustainable
development register, which will be administered by a
government-run management body.
14 Other project
operators can then buy these credits to ?compensate?
negative impacts of their own projects, such as polluting
a stream or damaging local communities? crops.15    (FERN)",,Preliminary,confirmed,,"Pilla. 2014. Inter-American Development Bank; (Quieter et al. 2015. Biodiversity offsets: Opportunities and challenges for managing cumulative impact of large-scale land-based investments on Africa's Forest Landscapes and their biodiversity- 

FERN.ND. http://www.fern.org/sites/fern.org/files/Trading%20away%20rights.pdf","French regulations impose an environmental impact assessment (EIA) that must be included in the Requests for commencement of work.According to regulations, the EIA drawn up by CREOCEAN comprised:
 the description of the current state of the site (or initial condition): physical environment, biological environment and human activities on and around the site, respectively for seismic activity and drilling, including regulatory protection.
 analysis of potential consequences for the activities envisaged on the natural and human environment,
 the list of measures that will be taken to avoid, eliminate or reduce as much as possible the disadvantages or nuisances that might be caused by this work.
CONCLUSIONS
The analysis demonstrated that the impacts of exploration drilling are negligible to low on water and fish.
The magnitude of the drilling's effects on more sensitive and emblematic aspects (turtles, cetaceans and birds) was evaluated as low to medium.
The sediment around the drilling wells was identified as a compartment that was poor to medium affected by the prospecting operations, particularly through waste fluid and drilling excavation that disturbs the physics-chemistry and the nature of the sea-bed.
Measures were recommended to reduce (aiming to lower the time parameter linked to each effect) and environmentally monitor before and after drilling around the wells.http://creocean.fr/en/eia-marine-environment-french-guiana",
Gabon,Organisation,Africa,Yes,Yes,Yes,Explicit,,Offshore,,Voluntary Corporate Standards,,,Partnership with Wildlife Conservation Society to improve EIA processes and the application of the mitigation hierarchy in offshore environments.,,,,,,"Tullow Oil, 2009 Corporate Responsibility Report, (2009). http://www.tullowoil.com/Media/docs/default-source/3_investors/2009-tullow-cr-report.pdf?sfvrsn=2 (accessed December 18, 2015).
Tullow Oil and WCS initiate a vast research project on the marine environment, Le Gabon.org. (2012). http://www.en.legabon.org/news/1241/tullow-oil-and-wcs-initiate-vast-research-project-marine-environment (accessed August 20, 2015). Tullow Oil, Biodiversity Research with the Wildlife Conservation Society, 2013. (n.d.). http://www.tullowoil.com/media/case-studies/biodiversity-research-with-the-wildlife-conservation-society (accessed August 20, 2015).",,
