Country,Scale,Region,Mandatory policy,Marine Specific,marine included,Implicit_Explicit,Type, Focus,Name,Legislation,Year,Name of Legislation,Objective,Mechanism,Length,Stage,Confirmed,"
Goal",Source,Other/ Notes,
Poland,European Union,Europe,Yes,No,Yes,Implicit,Compensation,Biodiversity,Natura 2000 (Marine),Legislation,2010,"*EU: In the Member States of the European Union, several Directives relevant to compensation are applicable, including the Birds and Habitats Directives, the European Liability Directive, and the EIA and SEA Directives.","EU legislation protects a wide variety of habitats and species. Compensation for damage occurring in Natura 2000 sites is a legal requirement of the EU Birds and Habitats Directives.

Although some working group participants suggest the NNL Initiative should be
restricted to the terrestrial and freshwater environment, others considered it
should also extend to coastal and marine environments. The Strategy and Staff
Working Paper are silent on this issue. Coastal habitats, like many freshwater or
high altitude habitats, are very dynamic and subject to rapid and large-scale
shifts in their physical characteristics (e.g. through coastal erosion, flooding,
rock-fall) with important consequences for biodiversity. This creates specific
challenges to assessing impacts and designing appropriate offsets. The marine
environment presents some additional challenges in applying the mitigation
hierarchy and compensating for residual impacts although there is growing
experience in this in Europe and worldwide, not least from impact assessments
done for marine Natura 2000 sites. 32 It remains debatable whether knowledge is
sufficient to apply compensation in the marine environment in a comprehensive
and systematic way but there is nonetheless considerable potential for offsetting
some types of impacts (e.g. of coastal defences, ports and navigation, energy
infrastructure) in the marine environment, while ensuring additional gains with
regard to existing legal obligations under the MSFD and the nature directives.
Whilst re-creation per se of sea-bed habitats is very difficult, restoration or ?functional re-creation? measures and averted risk offsets33 both offer opportunities in the marine environment. Similarly, although offsetting at the coast requires the resolution of different issues - not least reversibility questions associated with coastal erosion or with saline inundation34 - experience in coastal habitat restoration, creation and enhancement also continues to evolve. Further there may be opportunities to compensate for some marine activities by offsetting in the coastal environment.",,Unable to determine,In Progress,confirmed,NNL,"Tucker, Graham; Allen, Ben; Conway,
Mavourneen; Dickie, Ian; Hart, Kaley; Rayment, Matt; Schulp, Catharina; van Teeffelen,
Astrid (2013) Policy Options for an EU No Net Loss Initiative. Report to the European
Commission. Institute for European Environmental Policy, London.

http://ec.europa.eu/environment/nature/biodiversity/nnl/pdf/Subgroup_NNL_Scope_Objectives.pdf",,
Portugal ,European Union,Europe,Yes,No,Yes,Implicit,Compensation,Biodiversity,Natura 2000 (Marine),Legislation,2010,"*EU: In the Member States of the European Union, several Directives relevant to compensation are applicable, including the Birds and Habitats Directives, the European Liability Directive, and the EIA and SEA Directives.","EU legislation protects a wide variety of habitats and species. Compensation for damage occurring in Natura 2000 sites is a legal requirement of the EU Birds and Habitats Directives.

Although some working group participants suggest the NNL Initiative should be
restricted to the terrestrial and freshwater environment, others considered it
should also extend to coastal and marine environments. The Strategy and Staff
Working Paper are silent on this issue. Coastal habitats, like many freshwater or
high altitude habitats, are very dynamic and subject to rapid and large-scale
shifts in their physical characteristics (e.g. through coastal erosion, flooding,
rock-fall) with important consequences for biodiversity. This creates specific
challenges to assessing impacts and designing appropriate offsets. The marine
environment presents some additional challenges in applying the mitigation
hierarchy and compensating for residual impacts although there is growing
experience in this in Europe and worldwide, not least from impact assessments
done for marine Natura 2000 sites. 32 It remains debatable whether knowledge is
sufficient to apply compensation in the marine environment in a comprehensive
and systematic way but there is nonetheless considerable potential for offsetting
some types of impacts (e.g. of coastal defences, ports and navigation, energy
infrastructure) in the marine environment, while ensuring additional gains with
regard to existing legal obligations under the MSFD and the nature directives.
Whilst re-creation per se of sea-bed habitats is very difficult, restoration or ?functional re-creation? measures and averted risk offsets33 both offer opportunities in the marine environment. Similarly, although offsetting at the coast requires the resolution of different issues - not least reversibility questions associated with coastal erosion or with saline inundation34 - experience in coastal habitat restoration, creation and enhancement also continues to evolve. Further there may be opportunities to compensate for some marine activities by offsetting in the coastal environment.",,Unable to determine,In Progress,confirmed,NNL,"Tucker, Graham; Allen, Ben; Conway,
Mavourneen; Dickie, Ian; Hart, Kaley; Rayment, Matt; Schulp, Catharina; van Teeffelen,
Astrid (2013) Policy Options for an EU No Net Loss Initiative. Report to the European
Commission. Institute for European Environmental Policy, London.

http://ec.europa.eu/environment/nature/biodiversity/nnl/pdf/Subgroup_NNL_Scope_Objectives.pdf",,
Qatar,National,Asia,Yes,Yes,Yes,Explicit,Offset,Mangrove,NNL of mangrove,Legislation,unknown,,No net loss of mangroves (TenKate and Crowe 2014),,unable to determine,Preliminary,unconfirmed,NNL,Darbi et al. 2016; TenKate et al. 2014;,,
Qatar,Organisation,Asia,Yes,No,Yes,Explicit,Offset,Biodiversity,"Royal Dutch Shell Qatar - PEARL GTL PROJECT
",Voluntary,unknown,,,,unable to determine,In Progress,confirmed,," (Forest Trends. Mitigation Mail. 2008. http://www.forest-trends.org/documents/newsletters/mitmail.php?newsletterID=37

https://green.blogs.nytimes.com/2008/10/14/chatting-with-shell-about-co2/?_r=0

https://www.cbd.int/doc/meetings/cop/cop-09/information/cop-09-inf-29-en.pdf

Sillitoe, P., Alshawi, A. A., & Hassan, A. K. A. A. (2010). Challenges to conservation: land use change and local participation in the Al Reem Biosphere Reserve, West Qatar. Journal of ethnobiology and ethnomedicine, 6(1), 1.https://www.ncbi.nlm.nih.gov/pmc/articles/PMC2987904/","A skeptic of mitigation for environmental impacts discusses biodiversity offsets with particular emphasis on a Royal Dutch Shell Qatar biodiversity offset project in development.  Shell is planning on building a 300-hectare onshore facility?the world?s largest?in northeast Qatar.  In consultation with the Business and Biodiversity Offset Program, a nonprofit run jointly by Forest Trends, Conservation International and the Wildlife Conservation Society, Shell has assessed environmental impacts of its site and is currently in the process of selecting sites to offset the impact.  Some of their offset options include preserving terrestrial areas similar to the onshore facility, improving nesting sites for hawksbill turtles, and preserving coral reefs (Forest Trends 2008).",
Romania,European Union,Europe,Yes,No,Yes,Implicit,Compensation,Biodiversity,Natura 2000 (Marine),Legislation,2010,"*EU: In the Member States of the European Union, several Directives relevant to compensation are applicable, including the Birds and Habitats Directives, the European Liability Directive, and the EIA and SEA Directives.","EU legislation protects a wide variety of habitats and species. Compensation for damage occurring in Natura 2000 sites is a legal requirement of the EU Birds and Habitats Directives.

Although some working group participants suggest the NNL Initiative should be
restricted to the terrestrial and freshwater environment, others considered it
should also extend to coastal and marine environments. The Strategy and Staff
Working Paper are silent on this issue. Coastal habitats, like many freshwater or
high altitude habitats, are very dynamic and subject to rapid and large-scale
shifts in their physical characteristics (e.g. through coastal erosion, flooding,
rock-fall) with important consequences for biodiversity. This creates specific
challenges to assessing impacts and designing appropriate offsets. The marine
environment presents some additional challenges in applying the mitigation
hierarchy and compensating for residual impacts although there is growing
experience in this in Europe and worldwide, not least from impact assessments
done for marine Natura 2000 sites. 32 It remains debatable whether knowledge is
sufficient to apply compensation in the marine environment in a comprehensive
and systematic way but there is nonetheless considerable potential for offsetting
some types of impacts (e.g. of coastal defences, ports and navigation, energy
infrastructure) in the marine environment, while ensuring additional gains with
regard to existing legal obligations under the MSFD and the nature directives.
Whilst re-creation per se of sea-bed habitats is very difficult, restoration or ?functional re-creation? measures and averted risk offsets33 both offer opportunities in the marine environment. Similarly, although offsetting at the coast requires the resolution of different issues - not least reversibility questions associated with coastal erosion or with saline inundation34 - experience in coastal habitat restoration, creation and enhancement also continues to evolve. Further there may be opportunities to compensate for some marine activities by offsetting in the coastal environment.",,unable to determine,In Progress,confirmed,NNL,"Tucker, Graham; Allen, Ben; Conway,
Mavourneen; Dickie, Ian; Hart, Kaley; Rayment, Matt; Schulp, Catharina; van Teeffelen,
Astrid (2013) Policy Options for an EU No Net Loss Initiative. Report to the European
Commission. Institute for European Environmental Policy, London.

http://ec.europa.eu/environment/nature/biodiversity/nnl/pdf/Subgroup_NNL_Scope_Objectives.pdf",,
Russian Federation,National,Asia,Yes,No,Yes,Implicit,Offset,Environment,"""On protection of the environment'",Legislation,2002,"article 77 of federal law No. 7 of 10 January 2002

- Environmental law (2002).
""Environmental protection"" is the activity of governmental bodies of the Russian Federation, governmental bodies of Russian regions, local government bodies, public and other non- commercial associations, legal entities and natural persons aimed at preserving and restoring natural environment, rational use and reproduction of natural resources, prevention of ? negative effect of economic and other activities on the environment and elimination of the consequences of such effects (hereinafter also referred to as ""natural environment preservation activity"")"".
The law includes the EIA. (GiBop 2018)",,"General provisions on offsetting environmental impacts, including on fauna and ecosystems, are regulated by article 77 of
federal law No. 7 of 10 January 2002 ""on protection of the environment"": moral and physical persons responsible for
environmental impacts produced by the pollution, impoverishment, destruction and irrational exploitation of natural resources,
damage and rupture of the equilibrium of natural ecological systems or impacts on landscapes, and any other threat to the law
in the domain of the environment, are obliged to fully offset them in compliance with the legislation. Nonetheless, the
legislation is ambiguous as article 78 stipulates that environmental offsets are implemented on a voluntary basis or based on
notification of a court judgement. Under the terms of Russian legislation, the development of green spaces is considered to be
one method of offsetting environmental impacts.
Impacts on specific components of the environment and on biodiversity are also regulated by:
article 56 of federal law No. 52 of 24 April 1995 ""on wildlife"";
article 100 of federal law No. 200 of the Forest Code of the Russian Federation of 4 December 2006;
article 69 of federal law No. 74 of the Water Code of the Russian Federation of 3 June 2006;
article 53 of federal law No. 166 of 20 December 2004 ""on fisheries and conservation of aquatic biological resources"".
In theory, offsets relate to all species of fauna and flora. They can be implemented via measures in-kind or via financial
transfers. The latter are paid into the account of the municipal budget in accordance with Budget Code N 145 of the Russian
Federation of 31 July 1998, and are not assigned as targeted compensation. The calculation of the amount does not take into
consideration the actual level of the impacts or the cost of the measures to restore habitats, but is essentially based on the
number of species concerned according to the methods and taxes approved by the authorities. In some cases, these financial
transfers are not intended to fund biodiversity offsets. For example, financial resources intended to offset the effect on the
biological resources of aquatic environments are used by the Federal Fisheries Agency to develop the business of aquacultural
enterprises, and not to safeguard the biodiversity of these areas (Morandeau and Villaysak 2012).

In 14 of the countries studied, financial transfers may be substituted for offsets. In other words, a project developer is allowed to pay a sum as a means of offsetting, and does not then need to account for the suitability or successful implementation of the measures planned in light of the residual impacts of its project. Financial transfers have different configurations in different
countries. A distinction is made between:...financial transfers considered to be an offset method in their own right, equal to the measures ?in-kind? implemented
by the project developer. This is the case in India (CAMPA9), Brazil (National System of Conservation Units10), the United States (in-lieu fee programme11), the state of South Australia (Native Vegetation and Scattered Trees Offsets
Program), Norway and Russia....In Russia, financial transfers are not necessarily allocated to ecological measures: for example, transfers intended to offset
impacts on biological resources in aquatic environments are used by the Federal Fisheries Agency to develop the activity of
aquacultural industrialists and not to safeguard the biodiversity of these areas(Morandeau and Villaysak 2012)..",unable to determine,In Progress,confirmed,,Morandeau and Villaysak 2012.,"In most countries, sector-specific laws have been introduced to preserve biodiversity components that present particular challenges, such as wetlands (Canada, Russia and the United States),",
Russian Federation,Organisation,Asia,Yes,No,Unable to determine,Unable to determine,Compensation,,UNDP Pilot Project for 'in-kind' compensation,Voluntary,unknown,,"The main thrust of this project is to encourage companies to consider ?in-kind? compensation for biodiversity loss, and preferably offsets.",,unable to determine,In Progress,confirmed,,"Darbi et al. 2016; 

http://www.undp.ru/index.php?iso=RU&lid=1&cmd=programs&id=205","UNDP aims to build the capacity of the Russian energy sector to minimize negative impacts on biodiversity and mainstream biodiversity in the operations of energy resource extractive and power producing companies. The UNDP project targets companies operating in the coal mining, hydropower, and oil and gas sectors. Although EIA is required in Russia, biodiversity is often poorly addressed; there is no specific requirement for biodiversity assessment or ?in-kind? compensation for
biodiversity damage, and no explicit guidance. Existing compensation mechanisms focus predominantly on payments to government for such damage. UNDP is running pilot initiatives in different regions of the Russian Federation. A number of existing ?in-kind? compensation activities being provided by partner companies will be evaluated, and General Guidelines for ?best practice? offsetting are to be prepared. These Guidelines are to draw on current ?best practice? around the
world and respond to the needs of target stakeholders. The project began in 2011 and runs until 2017. It involves various Ministries (energy, economic development) and NGOs, as well as energy companies. (Darbi et al. 2016).",
Saipan,National,Pacific,Yes,No,No,Neither,Mitigation ,,,Legislation,1998,U.S. Endangered Species List,"Saipan, part of the US Commonwealth of the Northern Mariana Islands, is the location of the Saipan Upland Mitigation Bank. The bank sets a precedent as the  rst mitigation bank in the region and follows the US mitigation banking system. Established in 1998 to protect the habitat of the Nightingale Reed-Warbler, a bird on the Endangered Species List since 1970, the bank?s surrounding areas are under pressure from homestead development. The bank has 418.9 hectares under protection, with a proposed expansion of 62.4 hectares.6,7 (Madsen et al. 2011).",,unable to determine,,,,"Madsen et al. 2011

6. SpeciesBanking.com, ?Saipan Upland Mitigation
Bank listing,? http://www.speciesbanking.
com/pages/dynamic/banks.page.php?page_
id=7257&eod=1
7. Markit, ?A World First Biodiversity Registry,?
ht tp://www.marki tenvi ronmental . com/
ecosystemworld.php","The presence of EIAs in the region may lay a
framework for biodiversity markets - two offset
programs/projects already in existence are
located in Malaysia and Saipan.",
Senegel,National,Africa,Yes,No,Unable to determine,Unable to determine,EIA,,,Legislation,,,,,unable to determine,Potential,confirmed,,,. In Egypt and several other countries like Morocco and Senegal the focus is the EIA system.,
Sierra Leone,National,Africa,Yes,No,No,Neither,Offset,,"Abdulai Barrie then presented a case study of a biodiversity offset project in Sierra Leone. The
Bumbuna Hydro-electric project is undertaking compensatory conservation to offset the
construction of a major dam. The presentation focused on financing, institutional and social
issues. As well as support from the World Bank and African Development Bank, a key financing 
4
mechanism will be a 3% electricity tariff to be used for community development and
environmental management.",Voluntary,,The Bumbuna Hydroelectric Project (BHP),,,unable to determine,Implemented,,,"Kormos, R., Kormos, C. F., Humle, T., Lanjouw, A., Rainer, H., Victurine, R., ... & Williamson, E. A. (2014). Great apes and biodiversity offset projects in Africa: the case for national offset strategies. PloS one, 9(11), e111671.

http://projects.worldbank.org/P086801/sl-bumbuna-hydroelectric-environmental-social-management-project?lang=en&tab=overview",,
Singapore,National,Asia,Yes,No,Yes,Explicit,EIA,Environment,,Legislation,1999,Environmental Protection Act 1999,,,,Potential,confirmed,,"Madsen et al. 2011; ICCM-IUCN 2013;

Hesp, P. A. (1995). The Environmental Impact Assessment process in Singapore with particular respect to coastal environments and the role of NGOs. Journal of Coastal Conservation, 1(2), 135-144. http://www.aecen.org/sites/default/files/singapore_eia_casestudy_coastalandngorole.pdf",,
Slovakia,European Union,Europe,Yes,No ,No,Neither,Compensation,,No marine natura sites,Legislation,,"*EU: In the Member States of the European Union, several Directives relevant to compensation are applicable, including the Birds and Habitats Directives, the European Liability Directive, and the EIA and SEA Directives.

Federal Act 17 1992, Act No. 127/1994 on EIA","EU legislation protects a wide variety of habitats and species. Compensation for damage occurring in Natura 2000 sites is a legal requirement of the EU Birds and Habitats Directives.

Although some working group participants suggest the NNL Initiative should be
restricted to the terrestrial and freshwater environment, others considered it
should also extend to coastal and marine environments. The Strategy and Staff
Working Paper are silent on this issue. Coastal habitats, like many freshwater or
high altitude habitats, are very dynamic and subject to rapid and large-scale
shifts in their physical characteristics (e.g. through coastal erosion, flooding,
rock-fall) with important consequences for biodiversity. This creates specific
challenges to assessing impacts and designing appropriate offsets. The marine
environment presents some additional challenges in applying the mitigation
hierarchy and compensating for residual impacts although there is growing
experience in this in Europe and worldwide, not least from impact assessments
done for marine Natura 2000 sites. 32 It remains debatable whether knowledge is
sufficient to apply compensation in the marine environment in a comprehensive
and systematic way but there is nonetheless considerable potential for offsetting
some types of impacts (e.g. of coastal defences, ports and navigation, energy
infrastructure) in the marine environment, while ensuring additional gains with
regard to existing legal obligations under the MSFD and the nature directives.
Whilst re-creation per se of sea-bed habitats is very difficult, restoration or ?functional re-creation? measures and averted risk offsets33 both offer opportunities in the marine environment. Similarly, although offsetting at the coast requires the resolution of different issues - not least reversibility questions associated with coastal erosion or with saline inundation34 - experience in coastal habitat restoration, creation and enhancement also continues to evolve. Further there may be opportunities to compensate for some marine activities by offsetting in the coastal environment.",,,Not yet implemented fully,,NNL,"Tucker, Graham; Allen, Ben; Conway,
Mavourneen; Dickie, Ian; Hart, Kaley; Rayment, Matt; Schulp, Catharina; van Teeffelen,
Astrid (2013) Policy Options for an EU No Net Loss Initiative. Report to the European
Commission. Institute for European Environmental Policy, London.

http://ec.europa.eu/environment/nature/biodiversity/nnl/pdf/Subgroup_NNL_Scope_Objectives.pdf",,
