Country,Scale,Region,Mandatory policy,Marine Specific,marine included,Implicit_Explicit,Type, Focus,Name,Legislation,Year,Name of Legislation,Objective,Mechanism,Length,Stage,Confirmed,"
Goal",Source,Other/ Notes,
Mexico,National,North America,Yes,No ,Yes,Implicit,Offset (Compensation),Biodiversity,"EIA, Administration Programme of Environmental Justice",Legislation,1988,"General Law of Ecological Equilibrium and Protection of the Environment (Ley General de Equilibrio Ecol¢gico y Protecci¢n al Ambiente, LGEEPA)

Biodiversity Code (C¢digo para la Biodiversidad del Estado de M‚xico)

Villaroya et al., 2014 (complete extracts are in the Mexico-Notes file in Gdrive)?

 General Law on Sustainable Forestry (2003) ? Sets the obligation of making offset payments for land-use change of forest areas
Environmental Liability Act (2013) ? also requires offsets but only when impacts are not predicted or approved in the EIA and are deemed an environmental offence,

? Regulation of the General Law on Sustainable Forestry (2005) ? Sets the basis for regulating offset payments for land-use change of forest areas

? Agreement on Offsets Equivalency (2005) ? Sets the method for calculating the required offsets area

? Agreement on offsets costs ? Sets the reference costs for calculating the required offset payments

? The General Law on Ecological Balance and Environmental Protection of 1988 (LGEEPA) + The Official Mexican Rule NOM-120-SEMARNAT-2011 (for mining projects) ? enable the use of offsets but do not make any specific requirements or guidance for when or how they should be used.

? Mexico ? Specifically mention the Complete Mitigation Hierarchy (GIBOP 2018)","The general law on ecological balance and environmental protection of 1988 (most commonly known as the LGEEPA) also enables the use of offsets as does the Official Mexican Rule NOM-120-SEMARNAT-2011 which makes some provisions for offsets related to mining projects. Neither of these two laws can be considered a specific offset framework since they only enable the
use of offsets but do not make any specific requirements or guidance for when or how they should be used (Villaroya et al. 2014).","establishes the need for Environmental Impact Assessment (EIA), and the Secretary of Environment and Natural Resources (Secretar¡a de Medio Ambiente y Recursos Naturales, SEMARNAT) implements this law and determines if an EIA is required for any given development project. If an EIA is required, an Environmental Management Plan (EMP) is issued, consisting of separate mitigation, compensation and follow-up measures for development activities, and distinguishing on-site and off-site actions. The current system allow a choice of creating an offset (eg PEMEX Jaguaroundi project) or paying into compensation fund managed by the National Forestry Commission (Comisi¢n Nacional Forestal, CONAFOR) at a raio of greater than 1:1 (Conafor sets the ratio and completes reforestation activities).

The General Act on Ecological Equilibrium and Environmental Protection (LGEEPA), which
regulates the principles of the constitution in relation to environmental matters, includes the legal definitions of these ANPs, classifying them into six different categories: biosphere reserves, national  International Approaches to compensation for Impacts on Biological Diversity Final Report, February 2009 115 parks, marine national parks, areas for the protection of flora and fauna, special biosphere reserves, and natural monuments (Nadal 2001: 4). The system of natural protected areas is complemented by natural protected ecosystems under the UMA Pilot Programme9 that aims to integrate the ecosystem
approach of the CBD with the political system in the context of conservation and sustainable use of biodiversity (CBD 2006: 9).(Darbi et al.2009).

In contrast to other Latin American countries, Mexico has well developed environmental politics. Instruments for avoidance, minimisation and compensation are modelled on the US example. On-site measures (rehabilitation) and off-site  International Approaches to compensation for Impacts on 
38 measures (measures of equal value) are distinguished under Mexican EIAs. At the national level, the Administration Programme for Environmental Justice identifies the most important regions, which are those affected by adverse impacts arising from the activities of different sectors, and requires restoration, rehabilitation and / or compensation as appropriate (Darbi et al.2009

 Art. 2.60 of the Biodiversity Code, concerns environmental politics and its instruments and establishes a number of criteria. Firstly, the preservation and conservation of the ecological balance and the internalisation of costs are indispensable to the conservation of the environment, biodiversity and natural  International Approaches to compensation for Impacts on Biological Diversity Final Report, February 2009 114 resources. Secondly, the restoration, remediation, recovery and rehabilitation of the ecological balance are essential in order to face climate-related challenges and to stop desertification, erosion and salinisation
of soils as well as the disappearance of flora and fauna (Estado de Mexico 2005: 45f).
Furthermore, Art. 2.82 introduces the obligation for all stakeholders, including state and municipal authorities, the social sector and private organisations, communities and any individual, to act in a way that preserves, conserves, remediates, rehabilitates, recovers, restores and protects natural protected areas, biological diversity and its ecosystems (Estado de Mexico 2005: 52). (Darbi et al. 2009).

Cumulative/Indirect Impacts and Impact Significance: Several countries make provisions for evaluating strategic development plans under their general EIA regulations (Chile, Decree 40 of 2013; Peru, Supreme Decree 019-2009-MINAM; Mexico, LGEEPA of 1988; Venezuela, Decree 1257 of 1996). (Villaroya et al. 2014). ",,In Progress,confirmed,,"M. Darbi et al., International Approaches to
Compensation for Impacts on Biological Diversity.
Final Report, Dresden and Berlin, March 2009,
available at http://www.forest-trends.org/
publication_details.php?publicationID=522",,"With reference to the components of biological diversity, reference is made to the definition of the
CBD. Consequently, the Mexican National Biodiversity Strategy defines biodiversity as the degree
of variation between living organisms and ecologic complexes, which is expressed at different levels:
from the heterogeneity of chemical structures and genes to ecosystem variety (CONABIO 2000: 13). "
Mexico,National,North America,Yes,No,No,Neither,Offset,,"Program for Environmental Restoration and Compensation, Programa de
Restauraci¢n y Compensaci¢n Ambiental)",Legislation,,Environmental Liability Act 2013,"aims to compensate for regulation violations
and accidents through the planned restoration
or recovery of ecosystems and natural resources
on site, and then if that is not possible, avoiding
or mitigating damage elsewhere (Madsen et al, Darbi et al. 2009); requires offsets, but only when impacts are not predicted or approved in the EIA and are deemed an environmental offense (Villaroya 2014)","damages to biodiversity due to accidents or regulation violations. Compensation paid either in kind or in cash, is overseenAn agreement between Federal Environmental Attorney (Procuradur¡a Federal de Protecci¢n Ambiental, PROFEPA) and the National Commission for the Knowledge and Use of Biodiversity (Comision Nacional para el Conocimiento y Uso de la Biodiversidad, CONABIO)",,implemented,,,"(Madsen et al, Darbi et al. 2009), ten kate et al. 2004; ",,
Mexico,National,North America,Yes,No,No,Neither,Offset,,Sustainable forest development,Legislation,,Sustainable Forest Development Act of 2003,requires offsets for impacts that result in land-use change to forested areas.,"In Mexico offsets are always required for land-use change in
forest areas (Ley General de Desarrollo Forestal Sustentable 2003).
The agent responsible for offset implementation is the National
Forest Commission (CONAFOR by its Spanish acronym)
(Reglamento de la Ley General de Desarrollo Forestal Sustentable
2005), which decides the allocation of offset funds in projects
implemented by different entities (agrarian communities, land
owners, public administrations, research and education institutions
and NGOs among others). payment to the Mexican Forest Fund is the only tool enabled for developers to comply with the legal requirements regarding offsets (Ley General de Desarrollo Forestal Sustentable 2003). In 2013, approximately US$ 30 million have been allocated in
reforestation projects related to this offset scheme [37] (Villaroya et al 2014).","Duration of the project's
operation, i.e. from 15 to 50
years maximum (Morandeau and Villaysack)",implemented,,,Villarroya et al. 2014; Morandeau and Villaysack 2012;,,
Morocco,National,Africa,Yes,No,No,Neither,EIA,,Forests,,,,,,,Potential,unconfirmed,,Darbi et al. 2009; Morandeau and Vilaysack 2012; http://www.ecosystemmarketplace.com/marketwatch/biodiversity/africa/,,
Mozambique,National,Africa,Yes,No,Yes,Explicit,Offset,Biodiversity,Biodiversity roadmaps,Legislation,1997,Environmental Law (Law 20/1997),"This Roadmap seeks to provide a workable framework for appropriate biodiversity
offsets in Mozambique, despite existing constraints of data deficiency, institutional immaturity, and underdeveloped human capacity. The Roadmap and its recommendations must be viewed from this perspective. Industrial development will not wait for perfect biological knowledge to be obtained first. Even with constraints, No Net Loss is a valuable goal to aim for and a useful tool for helping the national Government to achieve its biodiversity objectives.

The Environmental Law is the overarching legal framework for environmental matters in Mozambique. Particularly relevant here for NNL is article 4, which discusses the general principles, specifically Principle 7 (the principle of Responsibility), on the basis of which 'whoever pollutes or in any way degrades the environment shall always have the obligation to repair or compensate for the resulting damage.' While no regulations are in place to implement this provision as of yet, this is an important starting point. Article 15 of the same law decrees that the issuance of an Environmental License precedes the issuance of any other commercial license. Since the license itself is only granted after the completion of an environmental and social assessment process, this is very strong protection for the environment and opens the space for inserting offset design into the process (World Bank 2016).

Environmental Impact Assessment Legislation. The current regulations for environmental and social impact assessment are predominantly contained in Decree 24/2004, although some sectors such as mining (Decree 26/2004) and petroleum (Decree 56/2010) have their own specific decrees with additional details. (World Bank 2016).","According to these legal instruments, the Mozambican environmental and social assessment process is supposed to: 

A. Analyse the project
B. Classify it, based on expected impacts, into one of three categories, with different levels of environmental impact assessment rigor required for each;
C. Identify all environmental impacts (quantitatively or at least qualitatively);
D. Require the propoent to develop mitigation masures (following the mitigation hierarchy);
E. Require the preparation of an Environmental Management Plan; and
F. Require a compensation Plan (but usually only for social impacts) (World bank 2016).

Once the applicable environmental documents are approved, the corresponding plan then became part of the project's speficif legal framework, and compliance with the applicable conditions becomes a binding requirement on the project developer. From a biodiversity offsets point of view, this means that if an Environmental Management Plan stipulates that an offset will be carried out, then this becomes mandatory for the development, even if the project is sold to another company.

The specific environmental regulations for the petroleum sector (Decree 56/2010) require the relevant Environmental Impact Assessment (EIA) to include the possibility of rehabilitation and compensation of negative environmental effects. as well as requiring that the cumulative impacts be taken into account. Although Moazambican EIAs have thus far mostly not complied with this requirement - partly due to lack of clear guidance on the acceptable mechanisms for doing so-biodiversity offsets are clearly an available tool to realize this obligation (World Bank 2016).",,In Progress,confirmed,NNL,World Bank Report.2016.  Biodiversity offsets in Mozambique - A Roadmap for implementation," In Egypt and several other countries like Morocco and Senegal the focus is the EIA system (Darbi et al. 2009). 

In most countries, sector-specific laws have been introduced to preserve biodiversity components that present particular challenges, such as wetlands (Canada, Russia and the United States), forest (Brazil, India, the Netherlands, Morocco and Russia) (Morandeau and Vilaysack 2012).

Regulatory drivers for biodiversity compensation are still in development across much of Africa. A number of countries ? Egypt, Morocco, Uganda, South Africa, Rwanda, and Madagascar ? have Environmental Impact Assessment (EIA) regulations, sectoral guidelines, or other policies in place providing a legal framework for compensation, though the mitigation hierarchy is typically not fully implemented or clearly defined (ecosystem marketplace).",
Namibia,National,Africa,Yes,No,Yes,Implicit,Offset,Biodiversity,"Strategic Environmental Management Plan (SEMP) 

Strategic Environmental Assessment (SEA)",Legislation,2008,"Strategic Environmental Management Plan (SEMP) 

Strategic Environmental Assessment (SEA)",," The SEMP included as one of its Environmental Quality Objectives maintaining the ecological integrity of sites by employing a mitigation hierarchy, with biodiversity offsets as an option.39 A landscape-level spatial assessment to identify biodiversity conservation priorities and landuse opportunities and constraints within the Uranium Province will be undertaken from 2011 through early 2012. The project includes a focus on biodiversity offsets and aggregated offsets and is being conducted under the auspices of the Ministry for Environment?s Strengthening the Protected Areas Network (SPAN) programme (Madsen et al. 2011). 

The aim of SEA is to provide decision makers and affected stakeholders with timely and relevant information on the potential environmental impacts of a PPP in order to modify the PPP to make it environmentally more sound. SEA is therefore a process that is inextricably linked to decision making. It facilitates the early consideration of environmental impacts, the examination of a broad array of potential alternatives, the generation of standard mitigation measures and the opportunity to address a wide range of impacts, including those that are cumulative, synergistic, indirect, long range, delayed and global - Strategic Environmental Assessment (SEA) for the coastal areas of Namibia?
",,In Progress,"policy confirmed, marine included unconfirmed",,"Pilla 2014, Madesen et al. 2011, TenKate et al. 2010

http://www.the-eis.com/data/literature/Strategic%20Environmental%20Assessment%20for%20the%20central%20Namib%20Uranium%20Rush_Final_Merged.pdf

Strategic Environmental Assessment (SEA) for the coastal areas of Namibia?.http://www.nacoma.org.na/cms_documents/Combined_SEA_report_31May2010_bgr.pdf

http://namibianuranium.org/portfolios/sea-semp/","It is important to remember that impacts on No Go areas may be indirect as well. An example of
this has been the construction of dams along the Zambezi River. Dam construction moderated the
river?s annual flood cycle, impacting negatively on prawn reproduction by reducing freshwater flow at a key moment in the life cycle, and also reducing the flooding to the Marromeu Reserve, causing it to shrink in size annually and allow easier penetration of poachers into the interior swamps. It
also increased risks to human settlement. This is because dam managers retain water in the early
part of the rainy season to make sure that the dam will actually fill. In years with late rain, the
dams get too full and water is released causing late season flooding downstream. Indirect effects
of this kind could also affect ?No Go? areas (and natural and critical habitat for that matter), and so
indirect impacts must also be accounted for (World Bank 2015).",
Netherlands,National,Europe,Yes,No,Yes,Explicit,Offset,Biodiversity,2012,Legislation,2012,"Environmental Management Act - an EIS must 'The competent authority may stipulate that, if it is not possible to limit all adverse effects
on the environment, the description of the alternatives pursuant to subsection 1 (b) must
include a description of the possible arrangements which may be made or measures
which may be taken elsewhere to compensate for the remaining adverse effects. '","seeks to incorporate no net loss into the business strategies of Dutch companies
and are investigating country-wide implementation.","At national level, central government is responsible for introducing the regulatory framework for offsetting and oversees the
application of the offset scheme by the 12 Dutch provincial authorities.
At provincial level, the Dutch Structure Plan for Rural Areas of 1995 (Structuurschema Groene Ruimte) outlined the ecological
network, Ecologische Hoofdstructuur (EHS), and charged the 12 provincial authorities with introducing a biodiversity offset
regulation into the provincial spatial development plans.
The offset proposed by the project developer is submitted to the provincial authority's Departments of Spatial Development and
Conservation (ROH) and Ecology (ECL). The observations of the ROH and ECL departments are verified by the Provincial Commission (ICCA). The project developer is informed of the conclusion and is responsible for making any required modifications. The project developer submits the final plan to the ROH department.
Finally, the provincial authority decides on the full or partial validation or rejection of the offset plan. With regards to development projects requiring offsets in the EHS and Natura 2000 ecological network, the provincial authority's Department of
Rural Areas (LG) is responsible for conducting field visits and drafting a report on the implementation of the compensatory measures. The Ministry of Economic Affairs, Agriculture and Innovation's (EL&I) Inspection Service (AID) is responsible for
inspecting projects providing offsets under the Fauna and Flora Act. The AID is often informed of any non-compliance with the Fauna and Flora Act by local nature conservation associations. In the case of the Forest Act, the provincial authority's LG department monitors compliance with the obligation to reafforest in the 3 years following the cutting of over 10 ares29 .According to the Court of Audits, the provincial authorities are no longer involved in implementing offsets when this is taken over by a nature conservation association such as Natuurmonumenten, which holds and manages 355 natural areas in the Netherlands totalling 102,000 ha and 2.5% of the national territory Morandeau and Villaysack. ","Cost of management to be
estimated over 30 years
Compensation bank pilot
project: 25 years",In Progress,confirmed,,Vaisiere et al. 2014; Morandeau and Villaysakc 2012;,"In Africa, a system is being developed by South Africa at a national level and at a state level. Namibia is integrating biodiversity offsets into their Strategic Environmental Assessment (SEA) (Pila et al. 2014). 

Namibia has taken some steps to include the concepts of the mitigation hierarchy and no net loss? in a Strategic Environmental Management Plan (SEMP) in response to a large increase in exploration and mining license applications. The country has been enacting a moratorium on issuing licenses since 2007 while a Strategic Environmental Assessment (SEA) was conducted for the Uranium Province (Erongo and Southern Kunene regions). In 2009, the SEA commenced and recommended biodiversity offsets ?for the residual negative impacts in order to
achieve a zero net loss to biodiversity and if possible make a net positive impact through other beneficial actions, e.g., supporting additional conservation activities.?38 Following the SEA, a Strategic Environmental Management Plan (SEMP) was drafted to provide a framework for addressing the impacts of development. (Madsen et al. 2011). 

 There are recent policy measures inColombia and France, measures are under development in countries such as South Africa, Peru and England, and exploration of policy options is in its early stages in a suite of other countries (e.g. Canada, Uganda, Namibia, Vietnam, Malaysia and Mongolia) (tenkate et al. 2010)",
Netherlands,European Union,Europe,Yes,No,Yes,Implicit,Compensation,Biodiversity,Natura 2000 (Marine),Legislation,2010,"*EU: In the Member States of the European Union, several Directives relevant to compensation are applicable, including the Birds and Habitats Directives, the European Liability Directive, and the EIA and SEA Directives.",,,,In Progress,confirmed,NNL,"Tucker, Graham; Allen, Ben; Conway,
Mavourneen; Dickie, Ian; Hart, Kaley; Rayment, Matt; Schulp, Catharina; van Teeffelen,
Astrid (2013) Policy Options for an EU No Net Loss Initiative. Report to the European
Commission. Institute for European Environmental Policy, London.

http://ec.europa.eu/environment/nature/biodiversity/nnl/pdf/Subgroup_NNL_Scope_Objectives.pdf","4.1. Measures presented as biodiversity offsets
Some measures for offsetting environmental residual impacts are presented in the EIA reports, but their equivalency and appropriateness need to be examined. First, some onshore measures are proposed to offset offshore impacts. For instance, the Netherlands government asked the Egmond aan Zee offshore wind farm (Netherlands) for a
?compensation plan for nature value? in order to offset the possible impact on the marineenvironment, in response to two appeals brought by an environmental association and an association protesting against the farm. The cost of the plan represented 0.2% of the total cost of the project. The six proposed measures were:
1. Expansion of De Putten bird reserve for coastal and migratory birds.
2. Fund for the benefit of (migratory) birds and marine organisms.
3. Decontaminating a former transmitting station for the benefit of the dune landscape.
4. Nature restoration of wet dune valley near Diederik parking lot at Egmond-Binnen.
5. A documentary film on nature and marine reserves in the North Sea to emphasize the beauty of the sea.
6. Support for initiative for fishing for litter.
There is a problem of equivalency here. Onshore measures are proposed for offshore impacts, and land-based, even coastal, functions are not the same as marine ones. Some measures address impacts other than those of the wind farm project. (Vaisierre et al)

In the Netherlands, the pressure of nature conservation associations is leading some project developers to voluntarily
implement offsetting. By way of example, within the framework of the proposed urban extension to the municipality ofAlmere (province of North Holland), local nature conservation associations have exerted pressure on the project developers to reafforest even though they were not legally obliged to offset. (Morandeau and Villaysack 2012)

Another assessment available in the Netherlands: an evaluation conducted by the Court of Audits in 2009 of the
implementation of offsetting in two Dutch provinces, underlines that the provincial authorities do not sufficiently guarantee that the compensatory measure is implemented appropriately, transparently or on time, or managed over the long term to avoid a net loss of the quality of the nature. According to another evaluation conducted in 2006 by the Inspectorate of the former Ministry of Housing, Spatial Planning and the Environment (VROM), of 40 projects providing offsets, 6 had effectively implemented the measures, 16 had partially implemented them and 18 had not implemented the prescribed measures at all. 

 In the Netherlands, where the amounts paid by the project developers into the Dutch National Fund for Rural Areas are intended to ensure offsetting ?in-kind? by the project developers themselves, the sums tend not to move (141 million Euros in 2008, 131 million Euros in 2009) due to the difficulty project developers have in identifying offset sites and meeting requirements relating to equivalence (Morandeau and Villaysack 2012). ",
